{
  "$schema": "https://json-schema.org/draft/2020-12/schema",
  "title": "Godot AI 2D Animation QA Report",
  "type": "object",
  "required": ["schema_version", "case_id", "summary", "checks"],
  "properties": {
    "schema_version": { "const": "1.0" },
    "case_id": { "type": "string", "minLength": 1 },
    "summary": {
      "type": "object",
      "required": ["critical", "warning", "info"],
      "properties": {
        "critical": { "type": "integer", "minimum": 0 },
        "warning": { "type": "integer", "minimum": 0 },
        "info": { "type": "integer", "minimum": 0 }
      },
      "additionalProperties": false
    },
    "checks": {
      "type": "array",
      "items": {
        "type": "object",
        "required": ["severity", "message"],
        "properties": {
          "severity": { "type": "string", "enum": ["critical", "warning", "info"] },
          "message": { "type": "string", "minLength": 1 },
          "path": { "type": "string" }
        },
        "additionalProperties": false
      }
    },
    "artifacts": {
      "type": "object",
      "properties": {
        "scene": { "type": "string" },
        "preview": { "type": "string" }
      },
      "additionalProperties": false
    }
  },
  "additionalProperties": false
}
