{
  "schema_version": "1.0",
  "case_id": "case_02_weapon_swordsman",
  "summary": {
    "critical": 0,
    "warning": 0,
    "info": 6
  },
  "checks": [
    {
      "severity": "info",
      "message": "rig metadata validation passed",
      "path": "fixtures/godot_demo_project/fixtures/cases/case_02_weapon_swordsman/rig_meta.json"
    },
    {
      "severity": "info",
      "message": "motion validation passed",
      "path": "fixtures/godot_demo_project/fixtures/cases/case_02_weapon_swordsman/motions/action.json"
    },
    {
      "severity": "info",
      "message": "motion validation passed",
      "path": "fixtures/godot_demo_project/fixtures/cases/case_02_weapon_swordsman/motions/idle.json"
    },
    {
      "severity": "info",
      "message": "motion validation passed",
      "path": "fixtures/godot_demo_project/fixtures/cases/case_02_weapon_swordsman/motions/move.json"
    },
    {
      "severity": "info",
      "message": "generated Godot scene exists",
      "path": "fixtures/godot_demo_project/fixtures/cases/case_02_weapon_swordsman/generated/case_02_weapon_swordsman.tscn"
    },
    {
      "severity": "info",
      "message": "preview artifact exists",
      "path": "fixtures/godot_demo_project/fixtures/cases/case_02_weapon_swordsman/generated/preview.png"
    }
  ],
  "artifacts": {
    "scene": "generated/case_02_weapon_swordsman.tscn",
    "preview": "generated/preview.png"
  }
}
