{
  "schema_version": "1.0",
  "case_id": "case_03_quadruped_beast",
  "summary": {
    "critical": 0,
    "warning": 0,
    "info": 6
  },
  "checks": [
    {
      "severity": "info",
      "message": "rig metadata validation passed",
      "path": "fixtures/godot_demo_project/fixtures/cases/case_03_quadruped_beast/rig_meta.json"
    },
    {
      "severity": "info",
      "message": "motion validation passed",
      "path": "fixtures/godot_demo_project/fixtures/cases/case_03_quadruped_beast/motions/action.json"
    },
    {
      "severity": "info",
      "message": "motion validation passed",
      "path": "fixtures/godot_demo_project/fixtures/cases/case_03_quadruped_beast/motions/idle.json"
    },
    {
      "severity": "info",
      "message": "motion validation passed",
      "path": "fixtures/godot_demo_project/fixtures/cases/case_03_quadruped_beast/motions/move.json"
    },
    {
      "severity": "info",
      "message": "generated Godot scene exists",
      "path": "fixtures/godot_demo_project/fixtures/cases/case_03_quadruped_beast/generated/case_03_quadruped_beast.tscn"
    },
    {
      "severity": "info",
      "message": "preview artifact exists",
      "path": "fixtures/godot_demo_project/fixtures/cases/case_03_quadruped_beast/generated/preview.png"
    }
  ],
  "artifacts": {
    "scene": "generated/case_03_quadruped_beast.tscn",
    "preview": "generated/preview.png"
  }
}
